{
  "sdk": "pdftract-py",
  "sdk_version": "0.1.0",
  "suite_version": "1.0.0",
  "schema_version": "1.0",
  "timestamp": "2026-09-26T06:21:29.540148+00:00",
  "results": [
    {
      "id": "extract-vector-scientific-paper",
      "status": "fail",
      "duration_ms": 0,
      "actual": {
        "pages": [
          {
            "page": 1,
            "width": 0,
            "height": 0,
            "rotation": 0,
            "spans": [],
            "blocks": [],
            "page_type": null,
            "tables": [],
            "annotations": [],
            "page_index": 0
          }
        ],
        "schema_version": "1.0",
        "metadata": {
          "page_count": 1,
          "title": null,
          "author": null,
          "subject": null,
          "keywords": null,
          "creator": null,
          "producer": null,
          "created": null,
          "modified": null,
          "diagnostics": [
            "STREAM_DECODE_ERROR: FlateDecode stream truncated or corrupt; returning partial output"
          ],
          "diagnostics_detailed": [
            {
              "code": "STREAM_DECODE_ERROR",
              "message": "STREAM_DECODE_ERROR: FlateDecode stream truncated or corrupt; returning partial output",
              "severity": "warning",
              "page_index": 0,
              "location": {
                "object_number": 8,
                "generation_number": 0
              },
              "hint": "Partial output returned for this stream; consider re-saving the PDF through a normalising tool"
            }
          ],
          "is_encrypted": null,
          "has_xmp": false,
          "has_title": false,
          "has_author": false,
          "has_creator": false
        },
        "errors": [],
        "fingerprint": "pdftract-v1:ab24a95f44ceca5d2aed4b6d056adddd8539f44c6cd6ca506534e830c82ea8a8",
        "form_fields": [],
        "links": [],
        "attachments": [],
        "threads": [],
        "javascript_actions": []
      },
      "expected": {
        "schema_version": "1.0",
        "metadata.page_count": 1,
        "pages.length": 1,
        "pages[0].page_index": 0,
        "pages[0].width": {
          "min": 500,
          "max": 700
        },
        "pages[0].height": {
          "min": 700,
          "max": 900
        },
        "pages[0].rotation": 0,
        "pages[0].spans.length": {
          "min": 1
        },
        "pages[0].blocks.length": {
          "min": 1
        },
        "pages[0].blocks[0].kind": "heading",
        "errors.length": 0
      },
      "reason": "pages[0].width: value 0 not in range [500, 700]",
      "classification": "core-layer",
      "classification_reason": "HEAD core pipeline, CLI/profile implementation, or shared fixture does not produce the suite-required content"
    },
    {
      "id": "extract-scanned-receipt",
      "status": "fail",
      "duration_ms": 0,
      "actual": {
        "pages": [
          {
            "page": 1,
            "width": 0,
            "height": 0,
            "rotation": 0,
            "spans": [],
            "blocks": [],
            "page_type": null,
            "tables": [],
            "annotations": [],
            "page_index": 0
          }
        ],
        "schema_version": "1.0",
        "metadata": {
          "page_count": 1,
          "title": null,
          "author": null,
          "subject": null,
          "keywords": null,
          "creator": null,
          "producer": null,
          "created": null,
          "modified": null,
          "diagnostics": [
            "STREAM_DECODE_ERROR: FlateDecode stream truncated or corrupt; returning partial output"
          ],
          "diagnostics_detailed": [
            {
              "code": "STREAM_DECODE_ERROR",
              "message": "STREAM_DECODE_ERROR: FlateDecode stream truncated or corrupt; returning partial output",
              "severity": "warning",
              "page_index": 0,
              "location": {
                "object_number": 8,
                "generation_number": 0
              },
              "hint": "Partial output returned for this stream; consider re-saving the PDF through a normalising tool"
            }
          ],
          "is_encrypted": null,
          "has_xmp": false,
          "has_title": false,
          "has_author": false,
          "has_creator": false
        },
        "errors": [],
        "fingerprint": "pdftract-v1:ab24a95f44ceca5d2aed4b6d056adddd8539f44c6cd6ca506534e830c82ea8a8",
        "form_fields": [],
        "links": [],
        "attachments": [],
        "threads": [],
        "javascript_actions": []
      },
      "expected": {
        "schema_version": "1.0",
        "metadata.page_count": 1,
        "pages.length": 1,
        "pages[0].page_index": 0,
        "pages[0].page_type": "scanned",
        "pages[0].spans.length": {
          "min": 1
        },
        "pages[0].blocks.length": {
          "min": 1
        },
        "pages[0].blocks[0].kind": "paragraph",
        "errors.length": 0
      },
      "reason": "pages[0].page_type: expected scanned, got None",
      "classification": "core-layer",
      "classification_reason": "HEAD core pipeline, CLI/profile implementation, or shared fixture does not produce the suite-required content"
    },
    {
      "id": "extract-encrypted-pdf",
      "status": "fail",
      "duration_ms": 0,
      "actual": {
        "pages": [
          {
            "page": 1,
            "width": 0,
            "height": 0,
            "rotation": 0,
            "spans": [
              {
                "text": "Encrypted PDF",
                "bbox": [
                  50.0,
                  700.0,
                  143.60000610351562,
                  712.0
                ],
                "font": "Unknown",
                "size": 12.0,
                "confidence": 0.30000001192092896
              }
            ],
            "blocks": [
              {
                "kind": "paragraph",
                "text": "Encrypted PDF",
                "bbox": [
                  50.0,
                  700.0,
                  143.60000610351562,
                  712.0
                ],
                "level": null
              }
            ],
            "page_type": null,
            "tables": [],
            "annotations": [],
            "page_index": 0
          }
        ],
        "schema_version": "1.0",
        "metadata": {
          "page_count": 1,
          "title": null,
          "author": null,
          "subject": null,
          "keywords": null,
          "creator": null,
          "producer": null,
          "created": null,
          "modified": null,
          "diagnostics": null,
          "diagnostics_detailed": null,
          "is_encrypted": null,
          "has_xmp": false,
          "has_title": false,
          "has_author": false,
          "has_creator": false
        },
        "errors": [],
        "fingerprint": "pdftract-v1:ab24a95f44ceca5d2aed4b6d056adddd8539f44c6cd6ca506534e830c82ea8a8",
        "form_fields": [],
        "links": [],
        "attachments": [],
        "threads": [],
        "javascript_actions": []
      },
      "expected": {
        "schema_version": "1.0",
        "metadata.is_encrypted": true,
        "pages.length": {
          "min": 1
        },
        "errors.length": 0
      },
      "reason": "metadata.is_encrypted: expected True, got None",
      "classification": "core-layer",
      "classification_reason": "HEAD core pipeline, CLI/profile implementation, or shared fixture does not produce the suite-required content"
    },
    {
      "id": "extract-fillable-form",
      "status": "fail",
      "duration_ms": 0,
      "actual": {
        "pages": [
          {
            "page": 1,
            "width": 0,
            "height": 0,
            "rotation": 0,
            "spans": [
              {
                "text": "Fillable Form",
                "bbox": [
                  50.0,
                  700.0,
                  143.60000610351562,
                  712.0
                ],
                "font": "Unknown",
                "size": 12.0,
                "confidence": 0.30000001192092896
              }
            ],
            "blocks": [
              {
                "kind": "paragraph",
                "text": "Fillable Form",
                "bbox": [
                  50.0,
                  700.0,
                  143.60000610351562,
                  712.0
                ],
                "level": null
              }
            ],
            "page_type": null,
            "tables": [],
            "annotations": [],
            "page_index": 0
          }
        ],
        "schema_version": "1.0",
        "metadata": {
          "page_count": 1,
          "title": null,
          "author": null,
          "subject": null,
          "keywords": null,
          "creator": null,
          "producer": null,
          "created": null,
          "modified": null,
          "diagnostics": null,
          "diagnostics_detailed": null,
          "is_encrypted": null,
          "has_xmp": false,
          "has_title": false,
          "has_author": false,
          "has_creator": false
        },
        "errors": [],
        "fingerprint": "pdftract-v1:ab24a95f44ceca5d2aed4b6d056adddd8539f44c6cd6ca506534e830c82ea8a8",
        "form_fields": [],
        "links": [],
        "attachments": [],
        "threads": [],
        "javascript_actions": []
      },
      "expected": {
        "schema_version": "1.0",
        "metadata.page_count": 1,
        "form_fields.length": {
          "min": 1
        },
        "pages.length": 1,
        "errors.length": 0
      },
      "reason": "form_fields.length: value 0 < minimum 1",
      "classification": "core-layer",